No.,Time,Source,Destination,Protocol,Length,Sequence Number (raw),Acknowledgment number (raw),Acknowledgment Number,Sequence Number,Info
32760,46.346792324,192.168.0.100,128.135.11.239,TCP,158,1535535667.0,0.0,0.0,0.0,"49734  >  443 [SYN, ECE, CWR] Seq=0 Win=65535 Len=0 MSS=1460 WS=64 TSval=3550670599 TSecr=0 SACK_PERM"
32763,46.346841089,128.135.11.239,192.168.0.100,TCP,154,3060339316.0,1535535668.0,1.0,0.0,"443  >  49734 [SYN, ACK, ECE] Seq=0 Ack=1 Win=65160 Len=0 MSS=1460 SACK_PERM TSval=80184333 TSecr=3550670599 WS=128"
32767,46.347235303,192.168.0.100,128.135.11.239,TCP,134,3382464730.0,0.0,0.0,825.0,49733  >  443 [RST] Seq=825 Win=0 Len=0
32771,46.347782097,192.168.0.100,128.135.11.239,TCP,146,1535535668.0,3060339317.0,1.0,1.0,49734  >  443 [ACK] Seq=1 Ack=1 Win=131712 Len=0 TSval=3550670603 TSecr=80184333
32775,46.349786275,192.168.0.100,128.135.11.239,TLSv1.3,865,1535535668.0,3060339317.0,1.0,1.0,Client Hello
32777,46.350680534,128.135.11.239,192.168.0.100,TCP,146,3060339317.0,1535536387.0,720.0,1.0,443  >  49734 [ACK] Seq=1 Ack=720 Win=64512 Len=0 TSval=80184339 TSecr=3550670604
32779,46.352096544,128.135.11.239,192.168.0.100,TLSv1.3,406,3060339317.0,1535536387.0,720.0,1.0,"Server Hello, Change Cipher Spec, Application Data, Application Data"
32783,46.3529045,192.168.0.100,128.135.11.239,TCP,146,1535536387.0,3060339577.0,261.0,720.0,49734  >  443 [ACK] Seq=720 Ack=261 Win=131456 Len=0 TSval=3550670606 TSecr=80184340
32790,46.35619417,192.168.0.100,128.135.11.239,TLSv1.3,226,1535536387.0,3060339577.0,261.0,720.0,"Change Cipher Spec, Application Data"
32791,46.356201708,192.168.0.100,128.135.11.239,TLSv1.3,729,1535536467.0,3060339577.0,261.0,800.0,Application Data
32793,46.35686224,128.135.11.239,192.168.0.100,TCP,146,3060339577.0,1535536467.0,800.0,261.0,443  >  49734 [ACK] Seq=261 Ack=800 Win=64512 Len=0 TSval=80184345 TSecr=3550670606
32797,46.360385914,128.135.11.239,192.168.0.100,TCP,146,3060339577.0,1535537050.0,1383.0,261.0,443  >  49734 [ACK] Seq=261 Ack=1383 Win=64000 Len=0 TSval=80184345 TSecr=3550670606
32798,46.360392388,128.135.11.239,192.168.0.100,TLSv1.3,465,3060339577.0,1535537050.0,1383.0,261.0,Application Data
32799,46.360402353,128.135.11.239,192.168.0.100,TLSv1.3,1594,3060339896.0,1535537050.0,1383.0,580.0,Application Data
32800,46.360406659,128.135.11.239,192.168.0.100,TLSv1.3,1419,3060341344.0,1535537050.0,1383.0,2028.0,"Application Data, Application Data"
32804,46.361300404,192.168.0.100,128.135.11.239,TCP,146,1535537050.0,3060339896.0,580.0,1383.0,49734  >  443 [ACK] Seq=1383 Ack=580 Win=131136 Len=0 TSval=3550670613 TSecr=80184345
32808,46.362152847,192.168.0.100,128.135.11.239,TCP,146,1535537050.0,3060342617.0,3301.0,1383.0,49734  >  443 [ACK] Seq=1383 Ack=3301 Win=128448 Len=0 TSval=3550670613 TSecr=80184347
32820,46.389559571,192.168.0.100,128.135.11.239,TLSv1.3,616,1535537050.0,3060342617.0,3301.0,1383.0,Application Data
32822,46.390125371,128.135.11.239,192.168.0.100,TCP,146,3060342617.0,1535537520.0,1853.0,3301.0,443  >  49734 [ACK] Seq=3301 Ack=1853 Win=64128 Len=0 TSval=80184378 TSecr=3550670641
32826,46.390610046,192.168.0.100,128.135.11.239,TCP,158,2000425227.0,0.0,0.0,0.0,"49735  >  443 [SYN, ECE, CWR] Seq=0 Win=65535 Len=0 MSS=1460 WS=64 TSval=2504988623 TSecr=0 SACK_PERM"
32828,46.3915746,128.135.11.239,192.168.0.100,TLSv1.3,1594,3060342617.0,1535537520.0,1853.0,3301.0,Application Data
32832,46.391684834,192.168.0.100,128.135.11.239,TCP,158,3883439901.0,0.0,0.0,0.0,"49736  >  443 [SYN, ECE, CWR] Seq=0 Win=65535 Len=0 MSS=1460 WS=64 TSval=321979770 TSecr=0 SACK_PERM"
32839,46.393669931,128.135.11.239,192.168.0.100,TCP,1594,3060344065.0,1535537520.0,1853.0,4749.0,443  >  49734 [ACK] Seq=4749 Ack=1853 Win=64128 Len=1448 TSval=80184379 TSecr=3550670641 [TCP segment of a reassembled PDU]
32840,46.393685371,128.135.11.239,192.168.0.100,TCP,1594,3060345513.0,1535537520.0,1853.0,6197.0,443  >  49734 [ACK] Seq=6197 Ack=1853 Win=64128 Len=1448 TSval=80184379 TSecr=3550670641 [TCP segment of a reassembled PDU]
32841,46.393693976,128.135.11.239,192.168.0.100,TCP,1594,3060346961.0,1535537520.0,1853.0,7645.0,"443  >  49734 [PSH, ACK] Seq=7645 Ack=1853 Win=64128 Len=1448 TSval=80184379 TSecr=3550670641 [TCP segment of a reassembled PDU]"
32842,46.393698545,128.135.11.239,192.168.0.100,TCP,1594,3060348409.0,1535537520.0,1853.0,9093.0,443  >  49734 [ACK] Seq=9093 Ack=1853 Win=64128 Len=1448 TSval=80184379 TSecr=3550670641 [TCP segment of a reassembled PDU]
32843,46.393704346,128.135.11.239,192.168.0.100,TCP,1594,3060349857.0,1535537520.0,1853.0,10541.0,443  >  49734 [ACK] Seq=10541 Ack=1853 Win=64128 Len=1448 TSval=80184379 TSecr=3550670641 [TCP segment of a reassembled PDU]
32844,46.393710371,128.135.11.239,192.168.0.100,TCP,1594,3060351305.0,1535537520.0,1853.0,11989.0,443  >  49734 [ACK] Seq=11989 Ack=1853 Win=64128 Len=1448 TSval=80184379 TSecr=3550670641 [TCP segment of a reassembled PDU]
32845,46.393718142,128.135.11.239,192.168.0.100,TCP,1594,3060352753.0,1535537520.0,1853.0,13437.0,"443  >  49734 [PSH, ACK] Seq=13437 Ack=1853 Win=64128 Len=1448 TSval=80184379 TSecr=3550670641 [TCP segment of a reassembled PDU]"
32846,46.393722652,128.135.11.239,192.168.0.100,TCP,1594,3060354201.0,1535537520.0,1853.0,14885.0,443  >  49734 [ACK] Seq=14885 Ack=1853 Win=64128 Len=1448 TSval=80184379 TSecr=3550670641 [TCP segment of a reassembled PDU]
32847,46.39372803,128.135.11.239,192.168.0.100,TCP,1594,3060355649.0,1535537520.0,1853.0,16333.0,"443  >  49734 [PSH, ACK] Seq=16333 Ack=1853 Win=64128 Len=1448 TSval=80184379 TSecr=3550670641 [TCP segment of a reassembled PDU]"
32848,46.393732518,128.135.11.239,192.168.0.100,TCP,154,2039132102.0,2000425228.0,1.0,0.0,"443  >  49735 [SYN, ACK, ECE] Seq=0 Ack=1 Win=65160 Len=0 MSS=1460 SACK_PERM TSval=80184379 TSecr=2504988623 WS=128"
32850,46.393761013,128.135.11.239,192.168.0.100,TCP,154,27179967.0,3883439902.0,1.0,0.0,"443  >  49736 [SYN, ACK, ECE] Seq=0 Ack=1 Win=65160 Len=0 MSS=1460 SACK_PERM TSval=80184381 TSecr=321979770 WS=128"
32855,46.394061502,192.168.0.100,128.135.11.239,TCP,146,1535537520.0,3060344065.0,4749.0,1853.0,49734  >  443 [ACK] Seq=1853 Ack=4749 Win=129600 Len=0 TSval=3550670643 TSecr=80184379
32856,46.394066306,192.168.0.100,128.135.11.239,TCP,146,1535537520.0,3060345513.0,6197.0,1853.0,49734  >  443 [ACK] Seq=1853 Ack=6197 Win=129600 Len=0 TSval=3550670644 TSecr=80184379
32857,46.39407069,192.168.0.100,128.135.11.239,TCP,146,1535537520.0,3060346961.0,7645.0,1853.0,49734  >  443 [ACK] Seq=1853 Ack=7645 Win=128128 Len=0 TSval=3550670644 TSecr=80184379
32858,46.394074418,192.168.0.100,128.135.11.239,TCP,146,1535537520.0,3060348409.0,9093.0,1853.0,49734  >  443 [ACK] Seq=1853 Ack=9093 Win=126720 Len=0 TSval=3550670644 TSecr=80184379
32866,46.394777631,192.168.0.100,128.135.11.239,TCP,146,1535537520.0,3060348409.0,9093.0,1853.0,[TCP Window Update] 49734  >  443 [ACK] Seq=1853 Ack=9093 Win=131072 Len=0 TSval=3550670644 TSecr=80184379
32867,46.394782291,192.168.0.100,128.135.11.239,TCP,146,1535537520.0,3060349857.0,10541.0,1853.0,49734  >  443 [ACK] Seq=1853 Ack=10541 Win=129600 Len=0 TSval=3550670644 TSecr=80184379
32868,46.394786541,192.168.0.100,128.135.11.239,TCP,146,1535537520.0,3060352753.0,13437.0,1853.0,49734  >  443 [ACK] Seq=1853 Ack=13437 Win=128128 Len=0 TSval=3550670644 TSecr=80184379
32869,46.394790258,192.168.0.100,128.135.11.239,TCP,146,1535537520.0,3060352753.0,13437.0,1853.0,[TCP Window Update] 49734  >  443 [ACK] Seq=1853 Ack=13437 Win=131072 Len=0 TSval=3550670644 TSecr=80184379
32871,46.395133119,128.135.11.239,192.168.0.100,TCP,1594,3060357097.0,1535537520.0,1853.0,17781.0,443  >  49734 [ACK] Seq=17781 Ack=1853 Win=64128 Len=1448 TSval=80184383 TSecr=3550670643 [TCP segment of a reassembled PDU]
32875,46.395908001,128.135.11.239,192.168.0.100,TLSv1.3,1594,3060358545.0,1535537520.0,1853.0,19229.0,Application Data
32876,46.395916858,128.135.11.239,192.168.0.100,TCP,1594,3060359993.0,1535537520.0,1853.0,20677.0,443  >  49734 [ACK] Seq=20677 Ack=1853 Win=64128 Len=1448 TSval=80184383 TSecr=3550670644 [TCP segment of a reassembled PDU]
32877,46.395920404,128.135.11.239,192.168.0.100,TCP,1594,3060361441.0,1535537520.0,1853.0,22125.0,443  >  49734 [ACK] Seq=22125 Ack=1853 Win=64128 Len=1448 TSval=80184383 TSecr=3550670644 [TCP segment of a reassembled PDU]
32878,46.395925343,128.135.11.239,192.168.0.100,TCP,1594,3060362889.0,1535537520.0,1853.0,23573.0,443  >  49734 [ACK] Seq=23573 Ack=1853 Win=64128 Len=1448 TSval=80184383 TSecr=3550670644 [TCP segment of a reassembled PDU]
32882,46.39765378,192.168.0.100,128.135.11.239,TCP,146,1535537520.0,3060357097.0,17781.0,1853.0,49734  >  443 [ACK] Seq=1853 Ack=17781 Win=126720 Len=0 TSval=3550670644 TSecr=80184379
32883,46.397658688,192.168.0.100,128.135.11.239,TCP,146,2000425228.0,2039132103.0,1.0,1.0,49735  >  443 [ACK] Seq=1 Ack=1 Win=131712 Len=0 TSval=2504988625 TSecr=80184379
32884,46.397662377,192.168.0.100,128.135.11.239,TCP,146,3883439902.0,27179968.0,1.0,1.0,49736  >  443 [ACK] Seq=1 Ack=1 Win=131712 Len=0 TSval=321979772 TSecr=80184381
32885,46.397666035,192.168.0.100,128.135.11.239,TCP,146,1535537520.0,3060357097.0,17781.0,1853.0,[TCP Window Update] 49734  >  443 [ACK] Seq=1853 Ack=17781 Win=131072 Len=0 TSval=3550670644 TSecr=80184379
32889,46.398716474,128.135.11.239,192.168.0.100,TCP,1594,3060364337.0,1535537520.0,1853.0,25021.0,443  >  49734 [ACK] Seq=25021 Ack=1853 Win=64128 Len=1448 TSval=80184383 TSecr=3550670644 [TCP segment of a reassembled PDU]
32890,46.39873619,128.135.11.239,192.168.0.100,TCP,1594,3060365785.0,1535537520.0,1853.0,26469.0,443  >  49734 [ACK] Seq=26469 Ack=1853 Win=64128 Len=1448 TSval=80184383 TSecr=3550670644 [TCP segment of a reassembled PDU]
32891,46.398740899,128.135.11.239,192.168.0.100,TCP,1594,3060367233.0,1535537520.0,1853.0,27917.0,"443  >  49734 [PSH, ACK] Seq=27917 Ack=1853 Win=64128 Len=1448 TSval=80184383 TSecr=3550670644 [TCP segment of a reassembled PDU]"
32892,46.39874922,128.135.11.239,192.168.0.100,TCP,1594,3060368681.0,1535537520.0,1853.0,29365.0,443  >  49734 [ACK] Seq=29365 Ack=1853 Win=64128 Len=1448 TSval=80184384 TSecr=3550670644 [TCP segment of a reassembled PDU]
32893,46.398754641,128.135.11.239,192.168.0.100,TCP,1594,3060370129.0,1535537520.0,1853.0,30813.0,443  >  49734 [ACK] Seq=30813 Ack=1853 Win=64128 Len=1448 TSval=80184384 TSecr=3550670644 [TCP segment of a reassembled PDU]
32894,46.398772637,128.135.11.239,192.168.0.100,TCP,1594,3060371577.0,1535537520.0,1853.0,32261.0,443  >  49734 [ACK] Seq=32261 Ack=1853 Win=64128 Len=1448 TSval=80184384 TSecr=3550670644 [TCP segment of a reassembled PDU]
32895,46.398778654,128.135.11.239,192.168.0.100,TCP,1594,3060373025.0,1535537520.0,1853.0,33709.0,443  >  49734 [ACK] Seq=33709 Ack=1853 Win=64128 Len=1448 TSval=80184384 TSecr=3550670644 [TCP segment of a reassembled PDU]
32896,46.398787541,128.135.11.239,192.168.0.100,TLSv1.3,1594,3060374473.0,1535537520.0,1853.0,35157.0,Application Data
32897,46.398792413,128.135.11.239,192.168.0.100,TCP,1594,3060375921.0,1535537520.0,1853.0,36605.0,"443  >  49734 [PSH, ACK] Seq=36605 Ack=1853 Win=64128 Len=1448 TSval=80184384 TSecr=3550670644 [TCP segment of a reassembled PDU]"
32901,46.399425078,128.135.11.239,192.168.0.100,TCP,1594,3060377369.0,1535537520.0,1853.0,38053.0,443  >  49734 [ACK] Seq=38053 Ack=1853 Win=64128 Len=1448 TSval=80184386 TSecr=3550670644 [TCP segment of a reassembled PDU]
32902,46.399443401,128.135.11.239,192.168.0.100,TCP,1594,3060378817.0,1535537520.0,1853.0,39501.0,443  >  49734 [ACK] Seq=39501 Ack=1853 Win=64128 Len=1448 TSval=80184386 TSecr=3550670644 [TCP segment of a reassembled PDU]
32903,46.399449161,128.135.11.239,192.168.0.100,TCP,1594,3060380265.0,1535537520.0,1853.0,40949.0,443  >  49734 [ACK] Seq=40949 Ack=1853 Win=64128 Len=1448 TSval=80184386 TSecr=3550670644 [TCP segment of a reassembled PDU]
32904,46.399453643,128.135.11.239,192.168.0.100,TCP,1594,3060381713.0,1535537520.0,1853.0,42397.0,443  >  49734 [ACK] Seq=42397 Ack=1853 Win=64128 Len=1448 TSval=80184386 TSecr=3550670644 [TCP segment of a reassembled PDU]
32908,46.401640388,128.135.11.239,192.168.0.100,TCP,1594,3060377369.0,1535537520.0,1853.0,38053.0,[TCP Retransmission] 443  >  49734 [ACK] Seq=38053 Ack=1853 Win=64128 Len=1448 TSval=80184386 TSecr=3550670644
32909,46.402250588,128.135.11.239,192.168.0.100,TCP,1594,3060378817.0,1535537520.0,1853.0,39501.0,[TCP Retransmission] 443  >  49734 [ACK] Seq=39501 Ack=1853 Win=64128 Len=1448 TSval=80184386 TSecr=3550670644
32910,46.402266607,128.135.11.239,192.168.0.100,TCP,1594,3060380265.0,1535537520.0,1853.0,40949.0,[TCP Retransmission] 443  >  49734 [ACK] Seq=40949 Ack=1853 Win=64128 Len=1448 TSval=80184386 TSecr=3550670644
32911,46.402287676,128.135.11.239,192.168.0.100,TCP,1594,3060381713.0,1535537520.0,1853.0,42397.0,[TCP Retransmission] 443  >  49734 [ACK] Seq=42397 Ack=1853 Win=64128 Len=1448 TSval=80184386 TSecr=3550670644
32912,46.402292583,128.135.11.239,192.168.0.100,TCP,1594,3060383161.0,1535537520.0,1853.0,43845.0,443  >  49734 [ACK] Seq=43845 Ack=1853 Win=64128 Len=1448 TSval=80184386 TSecr=3550670644 [TCP segment of a reassembled PDU]
32913,46.402298899,128.135.11.239,192.168.0.100,TCP,1594,3060384609.0,1535537520.0,1853.0,45293.0,"443  >  49734 [PSH, ACK] Seq=45293 Ack=1853 Win=64128 Len=1448 TSval=80184386 TSecr=3550670644 [TCP segment of a reassembled PDU]"
32917,46.402521424,192.168.0.100,128.135.11.239,TCP,146,1535537520.0,3060358545.0,19229.0,1853.0,49734  >  443 [ACK] Seq=1853 Ack=19229 Win=129600 Len=0 TSval=3550670646 TSecr=80184383
32918,46.402528059,192.168.0.100,128.135.11.239,TLSv1.3,865,2000425228.0,2039132103.0,1.0,1.0,Client Hello
32919,46.402532532,192.168.0.100,128.135.11.239,TCP,146,1535537520.0,3060361441.0,22125.0,1853.0,49734  >  443 [ACK] Seq=1853 Ack=22125 Win=126720 Len=0 TSval=3550670646 TSecr=80184383
32920,46.402536301,192.168.0.100,128.135.11.239,TCP,146,1535537520.0,3060362889.0,23573.0,1853.0,49734  >  443 [ACK] Seq=1853 Ack=23573 Win=125248 Len=0 TSval=3550670646 TSecr=80184383
32921,46.402539938,192.168.0.100,128.135.11.239,TCP,146,1535537520.0,3060364337.0,25021.0,1853.0,49734  >  443 [ACK] Seq=1853 Ack=25021 Win=123776 Len=0 TSval=3550670646 TSecr=80184383
32922,46.402543619,192.168.0.100,128.135.11.239,TCP,146,1535537520.0,3060364337.0,25021.0,1853.0,[TCP Window Update] 49734  >  443 [ACK] Seq=1853 Ack=25021 Win=131072 Len=0 TSval=3550670646 TSecr=80184383
32940,46.412210879,192.168.0.100,128.135.11.239,TCP,146,1535537520.0,3060358545.0,19229.0,1853.0,49734  >  443 [ACK] Seq=1853 Ack=19229 Win=129600 Len=0 TSval=3550670646 TSecr=80184383
32941,46.412228414,192.168.0.100,128.135.11.239,TCP,865,2000425228.0,2039132103.0,1.0,1.0,"[TCP Retransmission] 49735  >  443 [PSH, ACK] Seq=1 Ack=1 Win=131712 Len=719 TSval=2504988627 TSecr=80184379"
32942,46.412233251,192.168.0.100,128.135.11.239,TCP,146,1535537520.0,3060361441.0,22125.0,1853.0,49734  >  443 [ACK] Seq=1853 Ack=22125 Win=126720 Len=0 TSval=3550670646 TSecr=80184383
32943,46.412237057,192.168.0.100,128.135.11.239,TCP,146,1535537520.0,3060362889.0,23573.0,1853.0,49734  >  443 [ACK] Seq=1853 Ack=23573 Win=125248 Len=0 TSval=3550670646 TSecr=80184383
32944,46.412240729,192.168.0.100,128.135.11.239,TCP,146,1535537520.0,3060364337.0,25021.0,1853.0,49734  >  443 [ACK] Seq=1853 Ack=25021 Win=123776 Len=0 TSval=3550670646 TSecr=80184383
32945,46.41224436,192.168.0.100,128.135.11.239,TCP,146,1535537520.0,3060364337.0,25021.0,1853.0,[TCP Window Update] 49734  >  443 [ACK] Seq=1853 Ack=25021 Win=131072 Len=0 TSval=3550670646 TSecr=80184383
32949,46.41313704,128.135.11.239,192.168.0.100,TCP,1594,3060386057.0,1535537520.0,1853.0,46741.0,443  >  49734 [ACK] Seq=46741 Ack=1853 Win=64128 Len=1448 TSval=80184401 TSecr=3550670646 [TCP segment of a reassembled PDU]
32963,46.418836959,128.135.11.239,192.168.0.100,TCP,1594,3060386057.0,1535537520.0,1853.0,46741.0,[TCP Retransmission] 443  >  49734 [ACK] Seq=46741 Ack=1853 Win=64128 Len=1448 TSval=80184401 TSecr=3550670646
32964,46.418847162,128.135.11.239,192.168.0.100,TCP,1594,3060387505.0,1535537520.0,1853.0,48189.0,"443  >  49734 [PSH, ACK] Seq=48189 Ack=1853 Win=64128 Len=1448 TSval=80184401 TSecr=3550670646 [TCP segment of a reassembled PDU]"
32965,46.418852912,128.135.11.239,192.168.0.100,TCP,1594,3060388953.0,1535537520.0,1853.0,49637.0,443  >  49734 [ACK] Seq=49637 Ack=1853 Win=64128 Len=1448 TSval=80184401 TSecr=3550670646 [TCP segment of a reassembled PDU]
32966,46.418857726,128.135.11.239,192.168.0.100,TCP,1594,3060390401.0,1535537520.0,1853.0,51085.0,443  >  49734 [ACK] Seq=51085 Ack=1853 Win=64128 Len=1448 TSval=80184401 TSecr=3550670646 [TCP segment of a reassembled PDU]
32967,46.418863362,128.135.11.239,192.168.0.100,TLSv1.3,1594,3060391849.0,1535537520.0,1853.0,52533.0,Application Data
32968,46.418867882,128.135.11.239,192.168.0.100,TCP,1594,3060393297.0,1535537520.0,1853.0,53981.0,443  >  49734 [ACK] Seq=53981 Ack=1853 Win=64128 Len=1448 TSval=80184401 TSecr=3550670646 [TCP segment of a reassembled PDU]
32969,46.418873159,128.135.11.239,192.168.0.100,TCP,146,2039132103.0,2000425947.0,720.0,1.0,443  >  49735 [ACK] Seq=1 Ack=720 Win=64512 Len=0 TSval=80184401 TSecr=2504988627
32970,46.41887812,128.135.11.239,192.168.0.100,TCP,1594,3060394745.0,1535537520.0,1853.0,55429.0,"443  >  49734 [PSH, ACK] Seq=55429 Ack=1853 Win=64128 Len=1448 TSval=80184401 TSecr=3550670646 [TCP segment of a reassembled PDU]"
32971,46.418882291,128.135.11.239,192.168.0.100,TLSv1.3,406,2039132103.0,2000425947.0,720.0,1.0,"Server Hello, Change Cipher Spec, Application Data, Application Data"
32979,46.419706627,192.168.0.100,128.135.11.239,TLSv1.3,865,3883439902.0,27179968.0,1.0,1.0,Client Hello
32980,46.419711627,192.168.0.100,128.135.11.239,TCP,146,1535537520.0,3060365785.0,26469.0,1853.0,49734  >  443 [ACK] Seq=1853 Ack=26469 Win=129600 Len=0 TSval=3550670648 TSecr=80184383
32981,46.41971552,192.168.0.100,128.135.11.239,TCP,146,1535537520.0,3060368681.0,29365.0,1853.0,49734  >  443 [ACK] Seq=1853 Ack=29365 Win=126720 Len=0 TSval=3550670648 TSecr=80184383
32982,46.419719176,192.168.0.100,128.135.11.239,TCP,146,1535537520.0,3060368681.0,29365.0,1853.0,[TCP Window Update] 49734  >  443 [ACK] Seq=1853 Ack=29365 Win=131072 Len=0 TSval=3550670648 TSecr=80184383
32983,46.419722828,192.168.0.100,128.135.11.239,TCP,146,1535537520.0,3060371577.0,32261.0,1853.0,49734  >  443 [ACK] Seq=1853 Ack=32261 Win=128128 Len=0 TSval=3550670648 TSecr=80184384
32984,46.419726473,192.168.0.100,128.135.11.239,TCP,146,1535537520.0,3060373025.0,33709.0,1853.0,49734  >  443 [ACK] Seq=1853 Ack=33709 Win=131072 Len=0 TSval=3550670648 TSecr=80184384
32985,46.419730103,192.168.0.100,128.135.11.239,TCP,146,1535537520.0,3060377369.0,38053.0,1853.0,49734  >  443 [ACK] Seq=1853 Ack=38053 Win=128128 Len=0 TSval=3550670648 TSecr=80184384
32986,46.419733718,192.168.0.100,128.135.11.239,TCP,146,1535537520.0,3060377369.0,38053.0,1853.0,[TCP Window Update] 49734  >  443 [ACK] Seq=1853 Ack=38053 Win=131072 Len=0 TSval=3550670648 TSecr=80184384
32987,46.419737348,192.168.0.100,128.135.11.239,TCP,146,1535537520.0,3060380265.0,40949.0,1853.0,49734  >  443 [ACK] Seq=1853 Ack=40949 Win=128128 Len=0 TSval=3550670651 TSecr=80184386
32988,46.419743647,192.168.0.100,128.135.11.239,TCP,146,1535537520.0,3060383161.0,43845.0,1853.0,49734  >  443 [ACK] Seq=1853 Ack=43845 Win=125248 Len=0 TSval=3550670651 TSecr=80184386
32989,46.41974735,192.168.0.100,128.135.11.239,TCP,146,1535537520.0,3060383161.0,43845.0,1853.0,[TCP Window Update] 49734  >  443 [ACK] Seq=1853 Ack=43845 Win=131072 Len=0 TSval=3550670651 TSecr=80184386
32990,46.419750986,192.168.0.100,128.135.11.239,TCP,146,1535537520.0,3060386057.0,46741.0,1853.0,49734  >  443 [ACK] Seq=1853 Ack=46741 Win=128128 Len=0 TSval=3550670651 TSecr=80184386
32991,46.419754736,192.168.0.100,128.135.11.239,TCP,146,1535537520.0,3060386057.0,46741.0,1853.0,[TCP Window Update] 49734  >  443 [ACK] Seq=1853 Ack=46741 Win=131072 Len=0 TSval=3550670651 TSecr=80184386
32997,46.421546418,128.135.11.239,192.168.0.100,TCP,1594,3060396193.0,1535537520.0,1853.0,56877.0,443  >  49734 [ACK] Seq=56877 Ack=1853 Win=64128 Len=1448 TSval=80184409 TSecr=3550670648 [TCP segment of a reassembled PDU]
32998,46.421561501,128.135.11.239,192.168.0.100,TCP,1594,3060397641.0,1535537520.0,1853.0,58325.0,443  >  49734 [ACK] Seq=58325 Ack=1853 Win=64128 Len=1448 TSval=80184409 TSecr=3550670648 [TCP segment of a reassembled PDU]
33003,46.422487257,128.135.11.239,192.168.0.100,TCP,1594,3060396193.0,1535537520.0,1853.0,56877.0,[TCP Out-Of-Order] 443  >  49734 [ACK] Seq=56877 Ack=1853 Win=64128 Len=1448 TSval=80184409 TSecr=3550670648 [TCP segment of a reassembled PDU]
33004,46.422519273,128.135.11.239,192.168.0.100,TCP,1594,3060397641.0,1535537520.0,1853.0,58325.0,[TCP Retransmission] 443  >  49734 [ACK] Seq=58325 Ack=1853 Win=64128 Len=1448 TSval=80184409 TSecr=3550670648
33005,46.422525815,128.135.11.239,192.168.0.100,TCP,1594,3060399089.0,1535537520.0,1853.0,59773.0,443  >  49734 [ACK] Seq=59773 Ack=1853 Win=64128 Len=1448 TSval=80184409 TSecr=3550670648 [TCP segment of a reassembled PDU]
33006,46.422530338,128.135.11.239,192.168.0.100,TCP,146,27179968.0,3883440621.0,720.0,1.0,443  >  49736 [ACK] Seq=1 Ack=720 Win=64512 Len=0 TSval=80184409 TSecr=321979776
33007,46.422536367,128.135.11.239,192.168.0.100,TCP,1594,3060400537.0,1535537520.0,1853.0,61221.0,"443  >  49734 [PSH, ACK] Seq=61221 Ack=1853 Win=64128 Len=1448 TSval=80184409 TSecr=3550670648 [TCP segment of a reassembled PDU]"
33008,46.422540731,128.135.11.239,192.168.0.100,TCP,1594,3060401985.0,1535537520.0,1853.0,62669.0,443  >  49734 [ACK] Seq=62669 Ack=1853 Win=64128 Len=1448 TSval=80184409 TSecr=3550670648 [TCP segment of a reassembled PDU]
33009,46.422546404,128.135.11.239,192.168.0.100,TCP,1594,3060403433.0,1535537520.0,1853.0,64117.0,443  >  49734 [ACK] Seq=64117 Ack=1853 Win=64128 Len=1448 TSval=80184409 TSecr=3550670648 [TCP segment of a reassembled PDU]
33010,46.422551999,128.135.11.239,192.168.0.100,TCP,1594,3060404881.0,1535537520.0,1853.0,65565.0,"443  >  49734 [PSH, ACK] Seq=65565 Ack=1853 Win=64128 Len=1448 TSval=80184409 TSecr=3550670648 [TCP segment of a reassembled PDU]"
33014,46.423481307,128.135.11.239,192.168.0.100,TCP,1594,3060406329.0,1535537520.0,1853.0,67013.0,443  >  49734 [ACK] Seq=67013 Ack=1853 Win=64128 Len=1448 TSval=80184409 TSecr=3550670651 [TCP segment of a reassembled PDU]
33015,46.423496495,128.135.11.239,192.168.0.100,TLSv1.3,1594,3060407777.0,1535537520.0,1853.0,68461.0,Application Data
33016,46.423507052,128.135.11.239,192.168.0.100,TCP,1594,3060409225.0,1535537520.0,1853.0,69909.0,443  >  49734 [ACK] Seq=69909 Ack=1853 Win=64128 Len=1448 TSval=80184409 TSecr=3550670651 [TCP segment of a reassembled PDU]
33017,46.423512999,128.135.11.239,192.168.0.100,TCP,1594,3060410673.0,1535537520.0,1853.0,71357.0,443  >  49734 [ACK] Seq=71357 Ack=1853 Win=64128 Len=1448 TSval=80184409 TSecr=3550670651 [TCP segment of a reassembled PDU]
33018,46.423517605,128.135.11.239,192.168.0.100,TCP,1594,3060412121.0,1535537520.0,1853.0,72805.0,"443  >  49734 [PSH, ACK] Seq=72805 Ack=1853 Win=64128 Len=1448 TSval=80184409 TSecr=3550670651 [TCP segment of a reassembled PDU]"
33019,46.423535944,128.135.11.239,192.168.0.100,TCP,1594,3060413569.0,1535537520.0,1853.0,74253.0,443  >  49734 [ACK] Seq=74253 Ack=1853 Win=64128 Len=1448 TSval=80184409 TSecr=3550670651 [TCP segment of a reassembled PDU]
33020,46.42354186,128.135.11.239,192.168.0.100,TCP,1594,3060415017.0,1535537520.0,1853.0,75701.0,"443  >  49734 [PSH, ACK] Seq=75701 Ack=1853 Win=64128 Len=1448 TSval=80184409 TSecr=3550670651 [TCP segment of a reassembled PDU]"
33021,46.423546708,128.135.11.239,192.168.0.100,TCP,1594,3060416465.0,1535537520.0,1853.0,77149.0,443  >  49734 [ACK] Seq=77149 Ack=1853 Win=64128 Len=1448 TSval=80184409 TSecr=3550670651 [TCP segment of a reassembled PDU]
33025,46.424548689,128.135.11.239,192.168.0.100,TCP,1594,3060417913.0,1535537520.0,1853.0,78597.0,"443  >  49734 [PSH, ACK] Seq=78597 Ack=1853 Win=64128 Len=1448 TSval=80184409 TSecr=3550670651 [TCP segment of a reassembled PDU]"
33026,46.424564047,128.135.11.239,192.168.0.100,TCP,1594,3060419361.0,1535537520.0,1853.0,80045.0,443  >  49734 [ACK] Seq=80045 Ack=1853 Win=64128 Len=1448 TSval=80184410 TSecr=3550670651 [TCP segment of a reassembled PDU]
33027,46.424572151,128.135.11.239,192.168.0.100,TCP,1594,3060420809.0,1535537520.0,1853.0,81493.0,"443  >  49734 [PSH, ACK] Seq=81493 Ack=1853 Win=64128 Len=1448 TSval=80184410 TSecr=3550670651 [TCP segment of a reassembled PDU]"
33028,46.424578045,128.135.11.239,192.168.0.100,TCP,1594,3060422257.0,1535537520.0,1853.0,82941.0,443  >  49734 [ACK] Seq=82941 Ack=1853 Win=64128 Len=1448 TSval=80184410 TSecr=3550670651 [TCP segment of a reassembled PDU]
33029,46.424583748,128.135.11.239,192.168.0.100,TLSv1.3,1594,3060423705.0,1535537520.0,1853.0,84389.0,Application Data
33030,46.424588322,128.135.11.239,192.168.0.100,TCP,1594,3060425153.0,1535537520.0,1853.0,85837.0,443  >  49734 [ACK] Seq=85837 Ack=1853 Win=64128 Len=1448 TSval=80184410 TSecr=3550670651 [TCP segment of a reassembled PDU]
33031,46.424595665,128.135.11.239,192.168.0.100,TCP,1594,3060426601.0,1535537520.0,1853.0,87285.0,"443  >  49734 [PSH, ACK] Seq=87285 Ack=1853 Win=64128 Len=1448 TSval=80184410 TSecr=3550670651 [TCP segment of a reassembled PDU]"
33032,46.424601067,128.135.11.239,192.168.0.100,TLSv1.3,818,3060428049.0,1535537520.0,1853.0,88733.0,Application Data
33043,46.428031094,128.135.11.239,192.168.0.100,TCP,1594,3060417913.0,1535537520.0,1853.0,78597.0,"[TCP Retransmission] 443  >  49734 [PSH, ACK] Seq=78597 Ack=1853 Win=64128 Len=1448 TSval=80184409 TSecr=3550670651"
33044,46.428037413,128.135.11.239,192.168.0.100,TCP,1594,3060419361.0,1535537520.0,1853.0,80045.0,[TCP Retransmission] 443  >  49734 [ACK] Seq=80045 Ack=1853 Win=64128 Len=1448 TSval=80184410 TSecr=3550670651
33045,46.428045543,128.135.11.239,192.168.0.100,TCP,1594,3060420809.0,1535537520.0,1853.0,81493.0,"[TCP Retransmission] 443  >  49734 [PSH, ACK] Seq=81493 Ack=1853 Win=64128 Len=1448 TSval=80184410 TSecr=3550670651"
33046,46.428050088,128.135.11.239,192.168.0.100,TCP,1594,3060422257.0,1535537520.0,1853.0,82941.0,[TCP Retransmission] 443  >  49734 [ACK] Seq=82941 Ack=1853 Win=64128 Len=1448 TSval=80184410 TSecr=3550670651
33047,46.428055662,128.135.11.239,192.168.0.100,TCP,1594,3060423705.0,1535537520.0,1853.0,84389.0,"[TCP Retransmission] 443  >  49734 [PSH, ACK] Seq=84389 Ack=1853 Win=64128 Len=1448 TSval=80184410 TSecr=3550670651"
33048,46.428060109,128.135.11.239,192.168.0.100,TCP,1594,3060425153.0,1535537520.0,1853.0,85837.0,[TCP Retransmission] 443  >  49734 [ACK] Seq=85837 Ack=1853 Win=64128 Len=1448 TSval=80184410 TSecr=3550670651
33049,46.428065776,128.135.11.239,192.168.0.100,TCP,1594,3060426601.0,1535537520.0,1853.0,87285.0,"[TCP Retransmission] 443  >  49734 [PSH, ACK] Seq=87285 Ack=1853 Win=64128 Len=1448 TSval=80184410 TSecr=3550670651"
33050,46.42807003,128.135.11.239,192.168.0.100,TCP,818,3060428049.0,1535537520.0,1853.0,88733.0,"[TCP Retransmission] 443  >  49734 [PSH, ACK] Seq=88733 Ack=1853 Win=64128 Len=672 TSval=80184410 TSecr=3550670651"
33055,46.429600756,128.135.11.239,192.168.0.100,TCP,1594,3060417913.0,1535537520.0,1853.0,78597.0,"[TCP Retransmission] 443  >  49734 [PSH, ACK] Seq=78597 Ack=1853 Win=64128 Len=1448 TSval=80184409 TSecr=3550670651"
33056,46.429620036,128.135.11.239,192.168.0.100,TCP,1594,3060419361.0,1535537520.0,1853.0,80045.0,[TCP Retransmission] 443  >  49734 [ACK] Seq=80045 Ack=1853 Win=64128 Len=1448 TSval=80184410 TSecr=3550670651
33057,46.429628161,128.135.11.239,192.168.0.100,TCP,1594,3060420809.0,1535537520.0,1853.0,81493.0,"[TCP Retransmission] 443  >  49734 [PSH, ACK] Seq=81493 Ack=1853 Win=64128 Len=1448 TSval=80184410 TSecr=3550670651"
33058,46.429632736,128.135.11.239,192.168.0.100,TCP,1594,3060422257.0,1535537520.0,1853.0,82941.0,[TCP Retransmission] 443  >  49734 [ACK] Seq=82941 Ack=1853 Win=64128 Len=1448 TSval=80184410 TSecr=3550670651
33059,46.429638626,128.135.11.239,192.168.0.100,TCP,1594,3060423705.0,1535537520.0,1853.0,84389.0,"[TCP Retransmission] 443  >  49734 [PSH, ACK] Seq=84389 Ack=1853 Win=64128 Len=1448 TSval=80184410 TSecr=3550670651"
33060,46.429656298,128.135.11.239,192.168.0.100,TCP,1594,3060425153.0,1535537520.0,1853.0,85837.0,[TCP Retransmission] 443  >  49734 [ACK] Seq=85837 Ack=1853 Win=64128 Len=1448 TSval=80184410 TSecr=3550670651
33061,46.429660923,128.135.11.239,192.168.0.100,TCP,1594,3060426601.0,1535537520.0,1853.0,87285.0,"[TCP Retransmission] 443  >  49734 [PSH, ACK] Seq=87285 Ack=1853 Win=64128 Len=1448 TSval=80184410 TSecr=3550670651"
33062,46.429666399,128.135.11.239,192.168.0.100,TCP,818,3060428049.0,1535537520.0,1853.0,88733.0,"[TCP Retransmission] 443  >  49734 [PSH, ACK] Seq=88733 Ack=1853 Win=64128 Len=672 TSval=80184410 TSecr=3550670651"
33066,46.430995535,128.135.11.239,192.168.0.100,TCP,1594,3060417913.0,1535537520.0,1853.0,78597.0,"[TCP Retransmission] 443  >  49734 [PSH, ACK] Seq=78597 Ack=1853 Win=64128 Len=1448 TSval=80184409 TSecr=3550670651"
33067,46.431010927,128.135.11.239,192.168.0.100,TCP,1594,3060419361.0,1535537520.0,1853.0,80045.0,[TCP Retransmission] 443  >  49734 [ACK] Seq=80045 Ack=1853 Win=64128 Len=1448 TSval=80184410 TSecr=3550670651
33068,46.43101941,128.135.11.239,192.168.0.100,TCP,1594,3060420809.0,1535537520.0,1853.0,81493.0,"[TCP Retransmission] 443  >  49734 [PSH, ACK] Seq=81493 Ack=1853 Win=64128 Len=1448 TSval=80184410 TSecr=3550670651"
33069,46.431025123,128.135.11.239,192.168.0.100,TCP,1594,3060422257.0,1535537520.0,1853.0,82941.0,[TCP Retransmission] 443  >  49734 [ACK] Seq=82941 Ack=1853 Win=64128 Len=1448 TSval=80184410 TSecr=3550670651
33070,46.431029564,128.135.11.239,192.168.0.100,TCP,1594,3060423705.0,1535537520.0,1853.0,84389.0,"[TCP Retransmission] 443  >  49734 [PSH, ACK] Seq=84389 Ack=1853 Win=64128 Len=1448 TSval=80184410 TSecr=3550670651"
33071,46.431035354,128.135.11.239,192.168.0.100,TCP,1594,3060425153.0,1535537520.0,1853.0,85837.0,[TCP Retransmission] 443  >  49734 [ACK] Seq=85837 Ack=1853 Win=64128 Len=1448 TSval=80184410 TSecr=3550670651
33072,46.431042777,128.135.11.239,192.168.0.100,TCP,1594,3060426601.0,1535537520.0,1853.0,87285.0,"[TCP Retransmission] 443  >  49734 [PSH, ACK] Seq=87285 Ack=1853 Win=64128 Len=1448 TSval=80184410 TSecr=3550670651"
33073,46.431047061,128.135.11.239,192.168.0.100,TCP,818,3060428049.0,1535537520.0,1853.0,88733.0,"[TCP Retransmission] 443  >  49734 [PSH, ACK] Seq=88733 Ack=1853 Win=64128 Len=672 TSval=80184410 TSecr=3550670651"
33081,46.43183555,192.168.0.100,128.135.11.239,TCP,146,1535537520.0,3060393297.0,53981.0,1853.0,49734  >  443 [ACK] Seq=1853 Ack=53981 Win=125248 Len=0 TSval=3550670666 TSecr=80184401
33082,46.431844698,192.168.0.100,128.135.11.239,TCP,146,1535537520.0,3060394745.0,55429.0,1853.0,49734  >  443 [ACK] Seq=1853 Ack=55429 Win=131072 Len=0 TSval=3550670666 TSecr=80184401
33083,46.431849009,192.168.0.100,128.135.11.239,TCP,146,2000425947.0,2039132363.0,261.0,720.0,49735  >  443 [ACK] Seq=720 Ack=261 Win=131456 Len=0 TSval=2504988647 TSecr=80184402
33084,46.431853038,192.168.0.100,128.135.11.239,TCP,146,1535537520.0,3060396193.0,56877.0,1853.0,49734  >  443 [ACK] Seq=1853 Ack=56877 Win=131072 Len=0 TSval=3550670666 TSecr=80184401
33085,46.4318575,192.168.0.100,128.135.11.239,TLSv1.3,226,2000425947.0,2039132363.0,261.0,720.0,"Change Cipher Spec, Application Data"
33086,46.431862292,192.168.0.100,128.135.11.239,TLSv1.3,614,2000426027.0,2039132363.0,261.0,800.0,Application Data
33088,46.43205953,128.135.11.239,192.168.0.100,TLSv1.3,406,27179968.0,3883440621.0,720.0,1.0,"Server Hello, Change Cipher Spec, Application Data, Application Data"
33092,46.432423213,192.168.0.100,128.135.11.239,TCP,146,1535537520.0,3060399089.0,59773.0,1853.0,49734  >  443 [ACK] Seq=1853 Ack=59773 Win=128128 Len=0 TSval=3550670668 TSecr=80184409
33093,46.432428884,192.168.0.100,128.135.11.239,TCP,146,1535537520.0,3060399089.0,59773.0,1853.0,[TCP Window Update] 49734  >  443 [ACK] Seq=1853 Ack=59773 Win=131072 Len=0 TSval=3550670668 TSecr=80184409
33094,46.432432766,192.168.0.100,128.135.11.239,TCP,146,1535537520.0,3060401985.0,62669.0,1853.0,49734  >  443 [ACK] Seq=1853 Ack=62669 Win=128128 Len=0 TSval=3550670668 TSecr=80184409
33095,46.432436919,192.168.0.100,128.135.11.239,TCP,146,1535537520.0,3060406329.0,67013.0,1853.0,49734  >  443 [ACK] Seq=1853 Ack=67013 Win=123776 Len=0 TSval=3550670668 TSecr=80184409
33096,46.432441067,192.168.0.100,128.135.11.239,TCP,146,1535537520.0,3060406329.0,67013.0,1853.0,[TCP Window Update] 49734  >  443 [ACK] Seq=1853 Ack=67013 Win=131072 Len=0 TSval=3550670668 TSecr=80184409
33097,46.432444778,192.168.0.100,128.135.11.239,TCP,146,1535537520.0,3060409225.0,69909.0,1853.0,49734  >  443 [ACK] Seq=1853 Ack=69909 Win=128128 Len=0 TSval=3550670669 TSecr=80184409
33098,46.432448485,192.168.0.100,128.135.11.239,TCP,146,1535537520.0,3060412121.0,72805.0,1853.0,49734  >  443 [ACK] Seq=1853 Ack=72805 Win=127488 Len=0 TSval=3550670669 TSecr=80184409
33099,46.432452186,192.168.0.100,128.135.11.239,TCP,146,1535537520.0,3060412121.0,72805.0,1853.0,[TCP Window Update] 49734  >  443 [ACK] Seq=1853 Ack=72805 Win=131072 Len=0 TSval=3550670669 TSecr=80184409
33100,46.432455882,192.168.0.100,128.135.11.239,TCP,146,1535537520.0,3060415017.0,75701.0,1853.0,49734  >  443 [ACK] Seq=1853 Ack=75701 Win=128128 Len=0 TSval=3550670669 TSecr=80184409
33101,46.432460086,192.168.0.100,128.135.11.239,TCP,146,1535537520.0,3060415017.0,75701.0,1853.0,[TCP Window Update] 49734  >  443 [ACK] Seq=1853 Ack=75701 Win=131072 Len=0 TSval=3550670669 TSecr=80184409
33102,46.43246407,192.168.0.100,128.135.11.239,TCP,146,1535537520.0,3060417913.0,78597.0,1853.0,49734  >  443 [ACK] Seq=1853 Ack=78597 Win=128128 Len=0 TSval=3550670669 TSecr=80184409
33103,46.432468086,192.168.0.100,128.135.11.239,TCP,146,1535537520.0,3060417913.0,78597.0,1853.0,[TCP Window Update] 49734  >  443 [ACK] Seq=1853 Ack=78597 Win=131072 Len=0 TSval=3550670669 TSecr=80184409
33104,46.432472243,192.168.0.100,128.135.11.239,TCP,146,1535537520.0,3060420809.0,81493.0,1853.0,49734  >  443 [ACK] Seq=1853 Ack=81493 Win=128128 Len=0 TSval=3550670670 TSecr=80184410
33105,46.432475932,192.168.0.100,128.135.11.239,TCP,146,1535537520.0,3060423705.0,84389.0,1853.0,49734  >  443 [ACK] Seq=1853 Ack=84389 Win=125248 Len=0 TSval=3550670670 TSecr=80184410
33106,46.432479636,192.168.0.100,128.135.11.239,TCP,146,1535537520.0,3060423705.0,84389.0,1853.0,[TCP Window Update] 49734  >  443 [ACK] Seq=1853 Ack=84389 Win=131072 Len=0 TSval=3550670670 TSecr=80184410
33107,46.432483336,192.168.0.100,128.135.11.239,TCP,146,1535537520.0,3060426601.0,87285.0,1853.0,49734  >  443 [ACK] Seq=1853 Ack=87285 Win=128128 Len=0 TSval=3550670670 TSecr=80184410
33108,46.432487399,192.168.0.100,128.135.11.239,TCP,146,1535537520.0,3060426601.0,87285.0,1853.0,[TCP Window Update] 49734  >  443 [ACK] Seq=1853 Ack=87285 Win=131072 Len=0 TSval=3550670670 TSecr=80184410
33109,46.432491081,192.168.0.100,128.135.11.239,TCP,146,1535537520.0,3060428721.0,89405.0,1853.0,49734  >  443 [ACK] Seq=1853 Ack=89405 Win=128896 Len=0 TSval=3550670670 TSecr=80184410
33113,46.432858155,128.135.11.239,192.168.0.100,TCP,146,2039132363.0,2000426027.0,800.0,261.0,443  >  49735 [ACK] Seq=261 Ack=800 Win=64512 Len=0 TSval=80184420 TSecr=2504988647
33114,46.432863153,128.135.11.239,192.168.0.100,TCP,146,2039132363.0,2000426495.0,1268.0,261.0,443  >  49735 [ACK] Seq=261 Ack=1268 Win=64128 Len=0 TSval=80184421 TSecr=2504988648
33118,46.432929124,192.168.0.100,128.135.11.239,TCP,146,3883440621.0,27180228.0,261.0,720.0,49736  >  443 [ACK] Seq=720 Ack=261 Win=131456 Len=0 TSval=321979806 TSecr=80184410
33120,46.433190129,128.135.11.239,192.168.0.100,TLSv1.3,465,2039132363.0,2000426495.0,1268.0,261.0,Application Data
33124,46.433666548,192.168.0.100,128.135.11.239,TLSv1.3,226,3883440621.0,27180228.0,261.0,720.0,"Change Cipher Spec, Application Data"
33128,46.434099174,192.168.0.100,128.135.11.239,TCP,146,2000426495.0,2039132682.0,580.0,1268.0,49735  >  443 [ACK] Seq=1268 Ack=580 Win=131136 Len=0 TSval=2504988660 TSecr=80184421
33129,46.434105885,192.168.0.100,128.135.11.239,TLSv1.3,616,3883440701.0,27180228.0,261.0,800.0,Application Data
33131,46.434439921,128.135.11.239,192.168.0.100,TLSv1.3,1594,2039132682.0,2000426495.0,1268.0,580.0,Application Data
33135,46.434624824,128.135.11.239,192.168.0.100,TCP,1594,2039134130.0,2000426495.0,1268.0,2028.0,"443  >  49735 [PSH, ACK] Seq=2028 Ack=1268 Win=64128 Len=1448 TSval=80184422 TSecr=2504988648 [TCP segment of a reassembled PDU]"
33136,46.434634551,128.135.11.239,192.168.0.100,TCP,1594,2039135578.0,2000426495.0,1268.0,3476.0,443  >  49735 [ACK] Seq=3476 Ack=1268 Win=64128 Len=1448 TSval=80184422 TSecr=2504988648 [TCP segment of a reassembled PDU]
33140,46.435416977,128.135.11.239,192.168.0.100,TCP,1594,2039137026.0,2000426495.0,1268.0,4924.0,"443  >  49735 [PSH, ACK] Seq=4924 Ack=1268 Win=64128 Len=1448 TSval=80184422 TSecr=2504988648 [TCP segment of a reassembled PDU]"
33141,46.435431155,128.135.11.239,192.168.0.100,TCP,1594,2039138474.0,2000426495.0,1268.0,6372.0,443  >  49735 [ACK] Seq=6372 Ack=1268 Win=64128 Len=1448 TSval=80184422 TSecr=2504988648 [TCP segment of a reassembled PDU]
33142,46.435435799,128.135.11.239,192.168.0.100,TCP,1594,2039139922.0,2000426495.0,1268.0,7820.0,"443  >  49735 [PSH, ACK] Seq=7820 Ack=1268 Win=64128 Len=1448 TSval=80184422 TSecr=2504988648 [TCP segment of a reassembled PDU]"
33143,46.435441405,128.135.11.239,192.168.0.100,TCP,1594,2039141370.0,2000426495.0,1268.0,9268.0,443  >  49735 [ACK] Seq=9268 Ack=1268 Win=64128 Len=1448 TSval=80184422 TSecr=2504988648 [TCP segment of a reassembled PDU]
33144,46.435445742,128.135.11.239,192.168.0.100,TCP,146,27180228.0,3883440701.0,800.0,261.0,443  >  49736 [ACK] Seq=261 Ack=800 Win=64512 Len=0 TSval=80184422 TSecr=321979806
33148,46.435584608,192.168.0.100,128.135.11.239,TCP,146,2000426495.0,2039134130.0,2028.0,1268.0,49735  >  443 [ACK] Seq=1268 Ack=2028 Win=129728 Len=0 TSval=2504988661 TSecr=80184422
33149,46.435589329,192.168.0.100,128.135.11.239,TCP,146,2000426495.0,2039137026.0,4924.0,1268.0,49735  >  443 [ACK] Seq=1268 Ack=4924 Win=128128 Len=0 TSval=2504988661 TSecr=80184422
33150,46.435593868,192.168.0.100,128.135.11.239,TCP,146,2000426495.0,2039137026.0,4924.0,1268.0,[TCP Window Update] 49735  >  443 [ACK] Seq=1268 Ack=4924 Win=131072 Len=0 TSval=2504988661 TSecr=80184422
33154,46.436322777,128.135.11.239,192.168.0.100,TCP,1594,2039142818.0,2000426495.0,1268.0,10716.0,"443  >  49735 [PSH, ACK] Seq=10716 Ack=1268 Win=64128 Len=1448 TSval=80184422 TSecr=2504988648 [TCP segment of a reassembled PDU]"
33155,46.436333063,128.135.11.239,192.168.0.100,TCP,1594,2039144266.0,2000426495.0,1268.0,12164.0,443  >  49735 [ACK] Seq=12164 Ack=1268 Win=64128 Len=1448 TSval=80184422 TSecr=2504988648 [TCP segment of a reassembled PDU]
33156,46.43633786,128.135.11.239,192.168.0.100,TCP,1594,2039145714.0,2000426495.0,1268.0,13612.0,443  >  49735 [ACK] Seq=13612 Ack=1268 Win=64128 Len=1448 TSval=80184423 TSecr=2504988660 [TCP segment of a reassembled PDU]
33157,46.436343278,128.135.11.239,192.168.0.100,TCP,1594,2039147162.0,2000426495.0,1268.0,15060.0,"443  >  49735 [PSH, ACK] Seq=15060 Ack=1268 Win=64128 Len=1448 TSval=80184423 TSecr=2504988660 [TCP segment of a reassembled PDU]"
33158,46.436347594,128.135.11.239,192.168.0.100,TLSv1.3,465,27180228.0,3883440701.0,800.0,261.0,Application Data
33159,46.436351703,128.135.11.239,192.168.0.100,TCP,146,27180547.0,3883441171.0,1270.0,580.0,443  >  49736 [ACK] Seq=580 Ack=1270 Win=64128 Len=0 TSval=80184423 TSecr=321979807
33160,46.436355773,128.135.11.239,192.168.0.100,TLSv1.3,1594,27180547.0,3883441171.0,1270.0,580.0,Application Data
